{"assertion":"flag-off returns 404 with no rollup cache file write — byte-identical to the predecessor","expected_status":"off","id":"DEDUP-ATTR-003","kind":"dedup-attribution","producer":"scripts/dedup-attr/gen-fixtures.mjs","scenario":"flag-off","schema":"schemas/dedup-attribution-fixture.schema.json","shares_sum_to_one":false,"total_decisions":0}
